done,pid,title,category,cohort_year,tagline,abstract,limerick,pis,link,local_image,original_img
FALSE,brown,Brown Brothers Collection,DH Seed Grant Recipient,2020,Uncovering the historical data linking New York bankers to slavery,"The Brown Brothers Collection is a collaborative, cross-institutional research project that will develop robust teaching, research, and public humanities resources that leverage the digitized Brown Brothers & Company archives held by the New York Public Library. Founded in 1825 by Irish immigrants, this New York bank remains in operation as one of the largest private financial services firms in the city, Brown Brothers Harriman. An initial phase of collection’s digitization was recently completed with support from a Hidden Archives grant. We anticipate many kinds of stories that might be told from this collection, ranging from the history of global finance capital and the New York banking sector to New York City’s financial and administrative role in the slave economy. This pilot seeks to create a dataset and machine-readable transcriptions encompassing the contents of the original records, and to develop potential uses of the data by scholars, teachers, and the general public as an open-access resource.","Tom Augst and Nick Wolf’s work clearly shows
that big banks are worse than you suppose.
They were up to the knavery
Of bankrolling slavery
At the NYC house of Brown Bros.",augst; wolf,https://newyorkscapes.org/brownbrothers/,brown.jpg,https://newyorkscapes.org/wp-content/uploads/2021/03/018.57733030.117d9410-dc97-0136-03f0-000d5d842228-edited-768x768.jpeg
FALSE,pep,Developing a 'Publications Page' for NYU’s Prison Education Program (PEP) Website,DH Seed Grant Recipient,2020,Publishing research from incarcerated people.,"This project will establish a website that showcases the finest writing generated by students enrolled in NYU’s Prison Education Project. Unlike many websites that publish diaristic writing from the incarcerated, this website focuses on displaying students’ abilities as critical and creative thinkers fully capable of engaging in rigorous academic and scholarly work. The aim is to provide a wider forum for these students’ work and to illustrate the intellectual integrity of incarcerated students’ academic potential in ways that are not reflected in the existing publishing platforms. By highlighting their ability to see connections across disparate texts, to situate their experiences within the context of a broader intellectual history, and to use theoretical texts as prisms to deepen and expand the meaning and significance of a range of evidence, this project hopes to contribute to the reshaping of perceptions and understanding of the incarcerated.",,jacobs,https://prisoneducation.nyu.edu,pep.jpg,https://prisoneducation.nyu.edu/wp-content/uploads/2017/07/DSC_0418-1-250x250.jpg
FALSE,hiring-ai,Holding Hiring Algorithms Accountable and Creating New Tools for Humanistic Research,DH Seed Grant Recipient,2020,Revealing the reality of hiring patterns through AI,"The ""Holding Hiring Algorithms Accountable and Creating New Tools for Humanistic Research"" project is led by Prof. Hilke Schellmann (Journalism) and Dr. Mona Sloane (Tandon). It focuses on artificial intelligence (AI) and hiring. Thanks to AI, hiring is undergoing a quiet, yet earth-shaking revolution. Many Fortune 500 companies employ AI-based solutions to weed through the millions of job applications the companies receive every year. The problem\: many companies don\'t want to reveal what technology they are using and vendors don\'t want to reveal what\'s in the black box, despite evidence that some automated decision making systems make biased and/or arbitrary decisions. This project combines methods of investigative journalism, sociology, and data science to develop a new socio-technical tool for critically investigating and auditing AI systems used in hiring.","Using FOIA this team will soon try
To rewrite the story of why
If you don't get a job
It could be that the snob
That rejects you's a black-box AI
",schellmann; sloane,,,
FALSE,slave-insurance,Insuring Slavery: Underwriting Risk in the 18th Century,DH Seed Grant Recipient,2020,Documenting the growth of the insurance industry in the slave trade,"“Underwriting Risk in the 18th century” provides the first systematic analysis of the application of probabilistic mathematics to the trade in enslaved Africans during the designated period. It will provide foundational research for an exploration of the relationship between the marine insurance industry and the trans-Atlantic trade in human beings across more than one hundred years. This research is comprised of three activities that will produce two outcomes. The first activity involves systematically consulting the remaining records of every known Lloyd’s of London-affiliated underwriter in order to ascertain the extant information on the insurance of slave voyages through London’s largest insurance market. The second activity entails a reevaluation of insurance-focused archival collections for records pertaining to the trade of enslaved Africans as well as a reevaluation of slavery-focused archival collections for records pertaining to insurance. The third activity we intend to engage in is preliminary archival research on the relationship between the slave trade and insurance in Spain, Holland, and Switzerland as well as the insurance of slave-produced goods returning to Europe. The first result of our funded activities will be the foundational research that I use to comprehensively analyze how monetary value was produced and inscribed during the trans-Atlantic slave trade. The second result of our funded activities will be a vastly expanded data set to include in the digital ledger I founded and direct, Treasury of Weary Souls, which currently provides interactive, public access to all known insurance policies that underwrote enslaved persons as property on the plantations of the antebellum American South.","This project, our first love, that powered
our bottom line suddenly soured
when we lost our lucks 
of a half million bucks
With the PI decamping for Howard.",ralph,,slave-insurance.jpg,
FALSE,soul-of-reason,Raising the Volume: Amplifying Soul of Reason,DH Seed Grant Recipient,2020,Recovering hours of vital radio conversations with Black and Latino cultural leaders,"Raising the Volume is a cross-departmental initiative to transform a historically and culturally rich radio program on Black and Latino culture into a collaboratively curated collection as data. The NYU Division of Libraries and the NYU Institute of African American Affairs collaborated on a series of events in inviting community members to correct auto-generated transcripts of digital audio files of the radio program. In the second half of the project, we plan to collaboratively create and curate a dataset consisting of these transcriptions and Wikidata items and to support a graduate student project in the digital humanities.","the show called soul of reason
had guests from every region
host roscoe brown
was the talk of the town
to miss this would be treason",bunde,https://nyu-dss.github.io/soul-of-reason/,soul-of-reason.jpg,https://nyu-dss.github.io/soul-of-reason/images/uploads/roscoe-brown-IAAA.jpg
FALSE,jewish-cookbooks,The South African Jewish Cookbook Project,DH Seed Grant Recipient,2020,Documenting apartheid communities through their home life,"The South African Jewish Cookbook Project will digitize a corpus of 50 community cookbooks, created by South African Jewish women during the apartheid era. It will unite the cookbooks, collected from a broad range of institutions and private individuals spread across the globe, into a single digital collection. The project will present the cookbooks on a curated website, where users will be able to search, browse, and interact with the books, and read a series of interlinked encyclopedia-style articles exploring the wider significance of the cookbook corpus for South African and Jewish culture, history, and culinary practice. The project will be of particular value to members of the South African Jewish diaspora, particularly those interested in culinary heritage, communal history, and genealogical research, as well as for scholars working on topics relating to South Africa, food, Judaism, race, gender, and the postwar period. It will actively engage the public, encouraging users to contribute cookbooks and share written and video memories relating to the cookbooks and to South African Jewish food culture.","in twentieth century south africa
many jews decamped in diaspora
they published some books
of the things they cooked
latke, challah, matzoh",beinart-smollan,,,
FALSE,occupy,"
NO TURNING BACK: Ten Years After Occupy",Library Project,,"Representing the physical artifacts of ""#OccupyWallStreet"" a decade later.",This library-based exhibition uses Wax to tell the story of Occupy through historical materials.,"Downtown, revolutionaries poured
Through Zucotti, and archivists stored
Their papers. Now this Wax site's
All there is (no wealth tax, right?)
Because Occupy's got Thermidor'ed.",nyrop,https://specialcollections.hosting.nyu.edu/exhibitions/occupy/,occupy.jpg,"https://image1.dlib.nyu.edu:8183/iiif/2/photo%2Ftamwag_tam630_cuid34928%2Ftamwag_tam630_cuid34928_n000001_d.jp2/full/321,/0/default.jpg"
FALSE,moss,Inverting the Wunderkammer: Rethinking the Digital Humanities through Botanic Histories and Archives,DH Seed Grant Recipient,2021,Decolonial design for public humanities on botantic archives.,"Focusing on the the nineteenth-century bryological Mitten Collection at the New York Botanical Garden, this project uses moss--one of the most commonplace and adaptive plants in the world--to explore how experimental digital imaging techniques and pluralistic storytelling might be applied to colonial botanical collections to open up ways to critically interrogate violent systems of classification and order. Intersecting the history of science, critical archival studies, and recent interventions into decolonizing design, this digital humanities project uses a specific set of sources (ranging from archival and manuscript materials to herbarium specimens) to ask how women, indigenous experts, and working-class collectors’ contributions to the history of botany have been subsumed and silenced in the service of natural historical “authorship”--in this case, by the British bryologist William Mitten (1819-1906). By engaging a multitude of stakeholders across various fields and levels of expertise, this public-facing project explores how reading moss from multiple perspectives can engender new systems of knowledge production crossing colonial natural history, museum and archival studies, and decolonial design practices.","The topic's not obviously boss;
But with history and our secret sauce
of decolonial design,
and critical archives, you'll find
That your worldview will be changed by some moss.",ansari; ayers; brain,,,
FALSE,archcus,Archive of Cuban Socialism (ARCHCUS),DH Seed Grant Recipient,2021,,"The proposed Archive of Cuban Socialism (ARCHCUS) will document and archive the material culture of everyday life in Cuba between 1959 and 1990. It builds on an existing blog, Cuba Material, which will be expanded into a comprehensive, interactive, systematic, and user-friendly platform. Cuba Material has been a multi-year effort at the community and academic level to preserve and make available to scholars and other interested parties information regarding the common goods, fabrics, objects and uniforms, among other material objects, that circulated in Cuba following the 1959 Revolution. Both the objects and meanings (social, political, aesthetic) will be preserved in digital form for documentation and study. The innovative web platform will catalogue objects, male them easily searchable, host digital exhibitions, and provide mechanisms for additional contributions from the community, contextualization, and discussion. This makes it a significant contribution to the study of contemporary material culture as well as to Cuban, Caribbean, Latin American, and state socialist studies. ",,cabrera-arus,,,
FALSE,zinecat,The Zine Union Catalog (ZineCat),DH Seed Grant Recipient,2021,,"The Zine Union Catalog (aka ZineCat) is a union catalog dedicated to zines. A union catalog is a resource where libraries can share cataloging and holdings information. ZineCat lets researchers discover zine holdings by searching a single catalog, helps librarians copy catalog records to eliminate duplication of cataloging effort, and facilitates lending across libraries. ZineCat serves educators, researchers, librarians, archivists, and anyone in the general public with an interest in zines. Zines – self-published literature that often features counter cultural, political, and artistic content – are an increasingly important primary resource for humanities, social sciences, and other scholars, but due to the diverse standards and practices among the libraries, archives, and community organizations that collect and maintain them, accessing them through traditional research discovery systems is difficult. The initial prototype was developed by Lauren Kehoe (Faculty Librarian, NYU) and Jenna Freedman (Librarian, Barnard) in their MA Digital Humanities program at the City University of New York Graduate Center using 25 records from three libraries with different metadata schema: MARC, Dublin Core, and a spreadsheet-based standalone schema to a Collective Access catalog. The prototype has grown to include over 31,000 zines from six collections.","When confronted with DIY aesthetic
Catalogers oft become frenetic
They make systems to suffice
They can’t easily splice
‘Til ZineCat makes all copacetic
",kehoe,https://zinecat.org/,zinecat.jpg,
FALSE,covid-collections,COVID Collections,DH Seed Grant Recipient,2021,,"As COVID-19 began to dominate the global agenda during the spring of 2020, museums, libraries, and archives around the world announced efforts to document human experiences of illness, isolation, economic downturn, fear, adaptation, and solidarity. These efforts ranged widely in scale and methods, from local historical societies seeking personal reflections to large scale federally-funded oral history projects. What will become of these various collecting efforts, and how will scholars be able to locate them effectively? The COVID Collections Project aims to catalogue the many COVID-19 oral history, documentation, and archiving projects that have begun since winter 2020. As a multi-year project, we have started to survey repositories and oral historians to discover and catalogue the collections that are being built around the global experience of COVID-19. We will then develop a website that will help researchers find these collections. We also hope to foster collaborations among archivists, documentarists, and historians as the collections are being developed. The COVID Collections Project is a collaboration among the Initiative for Critical Disaster Studies (NYU Gallatin), the Archives and Public History Program (NYU GSAS), and the E.L. Quarantelli Resource Collection at the University of Delaware’s Disaster Research Center. ","Last year too many groups started selection
of COVID stuff, sans introspection
Since their sustainability's porous,
That leaves an opening for us
to make a covid collection, collection.",noonan; remes,https://wp.nyu.edu/disasters/covid-collections-project/,,
FALSE,dental-tools,"Creating a digital Museum of the History of Dentistry at the College of Dentistry, NYU.",DH Seed Grant Recipient,2021,,"Imagine a digital museum where artifacts appear in virtual reality in three dimensions and can be manipulated for full inspection. The College of Dentistry is creating such a museum by 3D scanning and digitizing its artifacts using the services of the LaGuardia Studio for high resolution scanning and a novel 3D display software called Sketchfab, to manipulate objects in space. The current effort is one of the very few in the World to utilize such technology for museum artifacts.","


These dental instruments are 3D!",spielman,,,
FALSE,g2021smith,"Dirty Money and Disorderly Homes: Civil Forfeiture, Vice Police, and Illicit Capital in Philadelphia",Grad Fellowship Project,2021,,,,smith,,,
FALSE,g2021marshall,Black Burials in Philadelphia: A Walking Tour,Grad Fellowship Project,2021,,,,marshall,https://bit.ly/blackburialstour,,
FALSE,g2021ozkiral,Reading Comments Reading Instagram Comics,Grad Fellowship Project,2021,,,,ozkiral,,,
FALSE,g2021zehngut-willits,Record-Keeping and the Golden Gate,Grad Fellowship Project,2021,,,,zehngut-willits,,,
FALSE,g2021petiwala,"Consuming India, Becoming Global: Contemporary Popular Culture and Branding between Mumbai, Dubai, and Cairo",Grad Fellowship Project,2021,,,,petiwala,,,
FALSE,g2021busser,Knitting Patterns for S.T.E.A.M. Education,Grad Fellowship Project,2021,,,,busser,,,
FALSE,g2021tsolakis,Ancestors and Family Traditions in the Hellenistic and Imperial Polis,Grad Fellowship Project,2021,,,,tsolakis,,,
FALSE,g2021joslyn,Organizing Resource Library,Grad Fellowship Project,2021,,,,joslyn,,,
FALSE,g2021armoza,Framing a Model: Literary Model Quality and the Autiobiography of Mark Twain,Grad Fellowship Project,2021,,,,armoza,,,
FALSE,soviet-sphere,The Post-Soviet Public Sphere: Multimedia Sourcebook of the 1990s,Externally Funded,,,"Following the collapse of the Soviet regime, Russia seemed poised to develop a robust public sphere. This unprecedented moment coincided with the global digital revolution, in particular the advent of the Internet — a resource whose immediate mobilization by wealthy political influencers epitomized the fragility of Russia’s newly liberated media commons. This project, funded by a NEH Collaborative Research Grant, investigates the encounter of the mainstream with the fringe, of ideologues and idealists, of dazzling creativity and rank commercialism in post-Soviet Russophone print, television, Web 1.0, and radio media. By preserving, interrogating, and (re-)interpreting key artifacts from the “long 1990s,” which began with Mikhail Gorbachev’s glasnost’ in 1986 and ended with the election of Vladimir Putin in 2000, our curated collection sheds light on a remarkable, if short-lived, period in recent Russian history.","in the days of mikhail gorbechov
russian publics felt like great improv
to prod from localhost
we push the glasnost
a media russophone ever so suave",vinkour,https://www.postsoviet90s.com/,soviet-sphere.jpg,https://images.squarespace-cdn.com/content/v1/59836ba83e00be476e5686a5/1501801511310-OM7GCIPWGCYXIJXIPG8E/image-asset.jpeg?format=1500w
FALSE,city-record,City Record Project,Externally Funded,,Digitized copies of the New York City Record from 1873 - 1949.,"The City Record Project hosts the New York City Record from its first volume in 1873 through 1949. The City Record contains data on every aspect of the city’s politics, society, economy, real estate and infrastructure development, employment, and expenditures and aids scholars studying the city because of the depth and breadth of the data it contains, offering digitized resources unmatched by any other city. Supported by a NEH Humanities Collections and Reference Resources grant, the digitized and searchable PDF documents openly accessible to the public.",,soffer,http://cityrecord.engineering.nyu.edu/,,
FALSE,nyscapes,NewYorkScapes,Project,,,"NewYorkScapes is a research community exploring the application of digital concepts, tools, and resources to the study of the history of urban cultures and landscapes. Founded in 2013, the initiative comprises a number of activities and faculty workshop dedicated to integrating teaching built around long-term digital projects into the larger collective research community. NewYorkScapes also seeks to make discoverable historic data related to the city of New York in both its non-digital and digital forms, and to collaboratively build that data for research purposes where it is not yet existent.",,wolf; augst,https://newyorkscapes.org/,nyscapes.jpg,https://newyorkscapes.org/wp-content/themes/sink_nyscapes/images/logo.png
FALSE,irish-speakers,Irish Speakers & the Empire City,Project,,,Irish Speakers & the Empire City is a collaborative endeavor to try to identify and record the household information of residents of New York City born in Ireland who claimed Irish (Gaelic) as their mother tongue on the 1910 census.,,wolf,https://irish-empire-city.nmwolf.net/,,
FALSE,artists-archive,Artists Archive Initiative,Project,,,"The Artist Archives Initiative promotes research and disseminates knowledge about the display and care of contemporary art. The initiative responds to a growing need for art world professionals and academic researchers to work with artists in building information resources to aid future exhibition and re-activation of their work. The Initiative contains the David Wojnarowicz Knowledge Base and the Joan Jonas Knowledge Base, which are resources intended to aid curators, conservators, and others who are researching the work these artists, and to assist in future exhibition and conservation of the artists' works.",,martin,https://artistarchives.hosting.nyu.edu/Initiative/,artists-archive.jpg,https://artistarchives.hosting.nyu.edu/Initiative/wp-content/uploads/2021/01/OHVR_PER_PHODOC_1972_AceGalleryLA_RNeiman_JJstudio-prnt005_ImageLink2-1024x679-1.jpg
FALSE,aponte,Digital Aponte,Project,,,"José Antonio Aponte was a free man of color, carpenter, artist, and alleged leader of a massive antislavery conspiracy and rebellion in colonial Cuba in 1811-1812. He was the creator of an unusual work of art - a “book of paintings” full of historical and mythical figures, including black kings, emperors, priests, and soldiers - that he showed to and discussed with fellow conspirators. The site provides an annotated version of the trial record of Aponte’s descriptions of the “book of paintings” and the the visual and textual references that connect Aponte’s vision of a black history situated in diasporic and transatlantic past with the possibility of imagining a sovereign future for free and enslaved people of color in colonial Cuba. ",,rodriguez; ferrer,https://aponte.hosting.nyu.edu/,aponte.jpg,https://aponte.hosting.nyu.edu/wp-content/uploads/2016/07/003.jpg
FALSE,sanger,Margaret Sanger Papers Project,Project,,,"The Margaret Sanger Papers Project is a historical editing project formed by Esther Katz and sponsored by the NYU's Department of History and Division of Libraries to locate, arrange, edit, research, and publish the papers of the noted birth control pioneer. The project has published a two-series edition and a four-volume book edition of Sanger's Papers as a result of work rearranging and organizing over 50,000 documents and a ten-year international search of over 1,500 archives and private collection.",,katz; nyrop; coble,https://sanger.hosting.nyu.edu/,sanger.jpg,https://sanger.hosting.nyu.edu/images/legacy/1929_writing.jpg
FALSE,wax,Wax,Software,,,"Wax is a minimal computing project for producing digital exhibitions focused on longevity, low costs, and flexibility. The underlying technology is made to learn and to teach, and can produce beautifully rendered, high-quality image collections and scholarly exhibits.",,nyrop,https://minicomp.github.io/wax/,wax.jpg,https://minicomp.github.io/wax/img/logo.png
FALSE,inquisite,Inquisite,Software,,,"Closely aligned with the objects of NewYorkScapes to provide support for the creation, design, and preservation of humanities data, support for the software platform Inquisite is being sought to facilitate the use of research data in the classroom and on long-term project development. Data and discipline agnostic, the platform is intended to fill needs among faculty and researchers for a low-technology-barrier interface for hosting and documenting data iteratively for research management purposes.",,wolf; augst,http://www.inquisite.org/,inquisite.jpg,http://www.inquisite.org/images/inquisite_collage.png
FALSE,bookworm,Bookworm,Software,,,"Bookworm makes it easy to interactively explore massive collections of texts as data. If you have a huge collection of texts, it provides a way to interpret them, make them explorable, and unlock them to a wide variety of uses even if you can't share them freely for copyright or other reasons. ",,schmidt,https://github.com/Bookworm-project,,
FALSE,directories,City Directories,dataset,,,,,wolf,,,
